Nombre,Precio con Tax,Precio Enviado
Blusa MK Azul con zipper S,,300
Blusa MK Azul con zipper XS,,300
Blusa MK Roja con zipper M,,300
Blusa MK Roja con zipper M,,300
Blusa Tommy Azul XS ,,225
Blusa Tommy Roja S,,225
Blusa Tommy Roja S Letras Rojas,,225
Blusa Tommy Roja XS Letras Rojas,,225
Blusa Tommy Azul oscuro M con letras blancas,,225
Blusa Tommy Azulo oscuro XS con letras blancas,,225
Blusa Tommy fusia con letras doradas S,,200
Blusa Tommy fusia con letras doradas XS ,,200
Polo Tommy con botones color salmon S,,250
Polo Tommy fusia con botones M,,250
Short Umbro Gris ,,175
Short Levis Azul Oscuro 501  26,,200
Short Levis Azul Oscuro 501  25,,200
Short Per Se Blanco con Rayas negras M,,150
Short Tommy M Azul con elastico,,200
Calson Victoria Secret Rjo con blanco con moñitos,,65
Calson Victoria Secret Rjo con blanco con moñitos,,65
Calson Victoria Secret Rjo con blanco con moñitos,,65
Calson Victoria Secret Rjo con blanco con moñitos,,65
Calson Victoria Secret Rojo,,65
Calson Victoria Secret Rojo,,65
Calson Victoria Secret Negro con Rayas Rosadas,,65
Calson Victoria Secret Negro con Rayas Rosadas,,65
Calson Victoria Secret Negro con Rayas Rosadas,,65
Calson Victoria Secret Negro con Rayas Rosadas,,65
Calson Victoria Secret Negro con Rayas Rosadas,,65
Calson Victoria Secret Negro con Rayas Rosadas,,65
Calson Victoria Secret Rosado con puntos negros,,65
Calson Victoria Secret Rosado con puntos negros,,65
Calson Victoria Secret Negros,,65
Calson Victoria Secret Negros,,65
Calson Victoria Secret Negros,,65
Calson Victoria Secret Estilo Tigre,,65
Calson Victoria Secret Estilo Tigre,,65
Calson Victoria Secret Blanco,,65
Calson Victoria Secret Celeste,,65
Calson Victoria Secret Cafe,,65
Calson Victoria Secret Corinto,,65
Body Lotion Frosted Coconut Snowball,,75
Body Lotion Frosted Coconut Snowball,,75
Body Lotion Frosted Coconut Snowball,,75
Body Lotion Warm Vanilla Sugar,,75
Body Lotion Strawberry snowflakes,,75
Body Cream Frosted coconut snowball,,90
Body Cream Frosted coconut snowball,,90
Victoria's Secret Coconut passion,,90
Victoria's Secret Coconut passion,,90
Victoria's Secret Sunsloope icy coconut & amber,,90
Victoria's Secret Bare Vanilla,,90
Victoria's Secret Velvet Petals candied,,90
Caja de Perfume Victoria's Secret The best of Mist,,250
Maletín DKNY Negro Pequeño ,,500
Maletín Guess Los Ángeles Crema,,450
Crossbody negro Tommy ,,280
Crossbody Azul Tommy con botón dorado,,280
Crossbody Guess Café no letras G,,400
Crossbody Guess Café Claro,,500
Cartera Tommy Cafe Claro ,,235
Maletín Crossbody Steve Madden Rosado con Monedero,,350
Crossbody Cafe Steve Malden con estilo cuadros,,350
Cartera Tommy Azul con Banderas ,,175
Cartera Tommy Azul con letras T H Azul y Blancas,,175
Maletín Nike Negro,,300
Cartera Crossbody Caramelo Nine West,,260
Gorra MK Cafe,,275
Gorra Tommy Azul,,200
Gorra Lacoste Cafe,,400
Maletín de Mano Adidas Negro,,200
Bolsa Puma en letras rosa,,150
Bolsa Rosada Sport,,140
Crossbody Lacoste Negro,,750
Cartera Lacoste Negra con textura,,750
Zapatos Tommy Blancos,,500
Zapatos Puma,,475
Biblia,,250
Cartera Negra Guess,,350
Cartera Negra Crossbody 4 zipper ,,260